question,document_identifier,question_identifier
What is cloud security, and why is it important for businesses using cloud computing?,, 
What are some of the common security risks associated with cloud computing?,, 
How do encryption and access controls contribute to cloud security?,, 
What role does identity and access management (IAM) play in cloud security?,, 
How does cloud provider compliance certifications impact cloud security?,, 
What measures can organizations take to mitigate the risks of data breaches in the cloud?,, 
How does cloud security differ from traditional on-premises security approaches?,, 
What are some best practices for securing cloud workloads and containers?,, 
How can organizations ensure data privacy and compliance in the cloud?,, 
What are the advantages of using cloud-native security solutions?,, 
